title,provider,type,domains,level,issue_date,expiry_date,credential_id,credential_url,learning_path,description,tags
Building Resilience (NASBA),LinkedIn,Course,Resilience; Professional Skills,Beginner,2025-09-01,,4a130e66b67c964513b1f07160d9f76889deb3f5b11994e4570581a08be0bcf6,https://www.linkedin.com/learning/certificates/4a130e66b67c964513b1f07160d9f76889deb3f5b11994e4570581a08be0bcf6?trk=share_certificate,Resilience Skills,"NASBA-variant over veerkracht, omgaan met druk en professioneel functioneren in veranderende werkomstandigheden.","LinkedIn; Resilience; Professional Skills; Human Skills; NASBA"
Teamwork Foundations,LinkedIn,Course,Teamwork; Collaboration,Beginner,2025-09-01,,53b258c9bc1f660b14040e4a1d224b10a32c719a4853611a1358d47dd8142654,https://www.linkedin.com/learning/certificates/53b258c9bc1f660b14040e4a1d224b10a32c719a4853611a1358d47dd8142654?trk=share_certificate,Teamwork Foundations,"Introductie tot effectief samenwerken, teamcommunicatie en professionele afstemming in werkcontext.","LinkedIn; Teamwork; Collaboration; Communication"
Teamwork Foundations (NASBA),LinkedIn,Course,Teamwork; Collaboration,Beginner,2025-09-01,,3ab3a8fc41f9133119ed1e0729c1787a4ed0dff57c19188745c8da995fd3e223,https://www.linkedin.com/learning/certificates/3ab3a8fc41f9133119ed1e0729c1787a4ed0dff57c19188745c8da995fd3e223?trk=share_certificate,Teamwork Foundations,"NASBA-variant over effectief samenwerken, teamcommunicatie en professionele afstemming in werkcontext.","LinkedIn; Teamwork; Collaboration; Communication; NASBA"
Teamwork Foundations (PMI),LinkedIn,Course,Teamwork; Collaboration,Beginner,2025-09-01,,8707b067dc9ddf4e89d42085df559887ebfb2475107cade98470164435b390b7,https://www.linkedin.com/learning/certificates/8707b067dc9ddf4e89d42085df559887ebfb2475107cade98470164435b390b7?trk=share_certificate,Teamwork Foundations,"PMI-variant over effectief samenwerken, teamcommunicatie en professionele afstemming in werkcontext.","LinkedIn; Teamwork; Collaboration; Communication; PMI"
vmbo/tl,Scholengemeenschap Guido de Brès,Diploma,Education; Secondary Education,Secondary Education,,,,,Secondary Education,"Diploma vmbo theoretische leerweg behaald bij Scholengemeenschap Guido de Brès.","Education; Secondary Education; vmbo/tl; Diploma"
Kaseya Certified Technician in Datto Backup,Kaseya University,Certification,Backup; Datto Backup; Business Continuity,Beginner,2026-07-16,2028-07-16,,,Kaseya Datto Backup,"Kaseya Certified Technician-certificering voor Datto Backup, gericht op basiskennis van backup, herstel en productgebruik binnen Kaseya/Datto-omgevingen.","Kaseya; Kaseya University; Datto Backup; Backup; Business Continuity; Certification"
Kaseya Certified Technician in Datto RMM,Kaseya University,Certification,RMM; Datto RMM; Remote Monitoring and Management,Beginner,2026-07-16,2028-07-16,,,Kaseya Datto RMM,"Kaseya Certified Technician-certificering voor Datto RMM, gericht op basiskennis van remote monitoring, endpointbeheer en productgebruik binnen Kaseya/Datto-omgevingen.","Kaseya; Kaseya University; Datto RMM; RMM; Remote Monitoring and Management; Certification"
Kaseya Certified Technician in IT Glue,Kaseya University,Certification,Documentation; IT Glue; IT Documentation,Beginner,2026-07-16,2028-07-16,,,Kaseya IT Glue,"Kaseya Certified Technician-certificering voor IT Glue, gericht op basiskennis van documentatiebeheer, informatiekwaliteit en productgebruik binnen Kaseya/IT Glue-omgevingen.","Kaseya; Kaseya University; IT Glue; Documentation; IT Documentation; Certification"
